"Y’know what? I’m not talking to you! You go back to sleep!  And you, are you a rapist?!",anger
Oh oh oh! I RESPECTFULLY DISAGREE!!,anger
When I was six years old.,neutral
"Yeah, yeah, I’m going to be out there spreading joy to the people.",joy
I didn’t get the annulment.,sadness
Okay.,neutral
No.,neutral
I mean you’re not the only ones on your honeymoon!,anger
"I tried to call you from the coffee shop, and there was no answer.",neutral
"No, things are fine with Kathy. I’m having a late dinner with her tonight, right after my early dinner with Casey.",neutral
"Thanks, but I kinda have a problem to deal with here.",fear
I’m sorry.,sadness
Huh?,neutral
You don't observe a dance class. You,neutral
"You should know, that we’re doing this for Frank and Alice, who you know, you’ve been there!",joy
"Oh, and deaf.",neutral
"That’s a uh, that’s a tough combination.",neutral
Thanks.,neutral
"Oh my God, how did you do that?",surprise
Shh.,neutral
"Okay, Monica: Right foot red.",neutral
"Joey, please!",fear
What’s the matter?,neutral
"Yeah, but, look I can handle it.",neutral
Phoebe! Don't put ideas in his head!,anger
"Yeah, well it came to about $112, but what the hell, just call it an even 110?",neutral
"Okay, okay, we’re approaching the window  Thread the needle.",neutral
"I’m telling you man, I saw it.",neutral
"Look, just because some idiot drew on your face doesn't mean you shouldn't have any fun!",neutral
You have no idea what a nightmare this has been. This is so hard.,sadness
"Forget that British chippy.""",sadness
"Your Fettuccini Alfredo looks a little dry, did you use all your cheese?",neutral
Expect it in 4-6 weeks.,neutral
I can’t!,anger
Twice?,neutral
"All right, there you go!",joy
"Okay, the reason why I asked you guys out to brunch today is because I have been doing some thinking about who should be my maid of honor.",neutral
"Okay, but this is the last time.",neutral
Hey Gunther. Hi.  I mean you’re going out on a date with the noisy guy upstairs?,surprise
Hi!,joy
"Oh, what was that for? Like a bake sale?",surprise
I would love to live with you Ross.. that’s-that’s great! Thank you!,joy
"Really, it’s fine, whatever you want.",neutral
I’m sorry.,sadness
"Uh-oh the laundry's done, uh-oh, uh-oh.",neutral
Much,neutral
Joey.,neutral
I thought they could...I'll try to get back as soon as I can. I'm sorry.,sadness
What?!  What the hell?!,anger
Chandler? Do you promise to be good?,neutral
Don’t touch him!,anger
"No, I got him.",neutral
"This has a little bit of orange peel, but no nutmeg.",neutral
"You sure are naming a lot of ways to postpone sex, I’ll tell ya",neutral
I’m your mother.,neutral
"I mean, I love-I love this little guy!",joy
"All right, well, you're right, these are the best oatmeal cookies I've ever had.",surprise
"Okay, I had to put on lotion!",neutral
"Chandler,  you call me when this goes in the pooper.",neutral
"Umm, she kissed me.",sadness
"Yeah well, once again not knocking pays off. I only wish you hadn’t been on the toilet.",surprise
You think it looked amazing?,sadness
I called the company that sent and th-they don’t care!,anger
Joey...,neutral
"No, you have to let me in right now!!",joy
Could be Casey.,neutral
My mommies love me. That's clever.,joy
Huh?,anger
"Well, let me ask you something, was Kip a better roommate than me?",sadness
"Uhh, do you mind sitting there. I’m-I’m saving this for my friend Ross.",neutral
"All right, I’ll tell her.  Come on bugger face!",anger
"And you would read alone in your room, and your puzzles...",neutral
Monica! I’m not gonna screw it up!,anger
So did you do it?,surprise
"Well umm, they both have a egg yolk and butter base, but a bearnaise has shallots, shirvel, and most importantly tarragon.",neutral
"Ross, come on!",anger
It worked!,surprise
"So this year, I’m going to do the whole city.",joy
I don’t think you could ever do that.,neutral
"Yeah, we’re gonna go.",neutral
WE WON!! Thank you! Yes!,joy
Get out!!,anger
"Oh yeah! Yeah, no, we’re gonna connect, y'know bond, and everything.",joy
Also so,neutral
"Don’t tell me, because of the big nostril thing?",surprise
"No, no, that's not what we ordered... We ordered a fat-free crust with extra cheese.",sadness
"Y’know, I always felt like you and I have this-this special bond.",neutral
"Seriously, good game though. Good game.   What are they so mad about? They get the apartment back!",surprise
"Well, I-I could live without it.",neutral
Where is this party?,neutral
Come on!,anger
He does?,surprise
Is that why you became a chef? So that people would like you?,surprise
Hello?,surprise
"Well, I was having a conversation.",neutral
"Oh, you go out with him.",neutral
"Oh my God, what a great surprise! This is such a beautiful house.",joy
"I’m Rhonda,  and these aren’t real!",neutral
I hope you do too.,neutral
"And I do, I have to make",sadness
It’s really classy!,joy
It would be nice to have a little guarantee though.,neutral
"It’s-it’s, they’re-they’re wearing it in Milan, so part of my job is too wear the clothes, and then I see how people respond, and then I report back to my superiors at",neutral
I guess.,sadness
Oh really? That’d be great! You guys can be the contestants!,surprise
Thanks for picking out the earrings man.,neutral
Radiator.,neutral
Just like you told her you did!  ... Just pointing out the irony.,neutral
"Ben, you ready?",neutral
"Please, don’t play the music. Just uh one more.",joy
"I’m sorry I’m late, did I miss anything?",neutral
"Oh, no, no. I just meant hypothetically.",neutral
"Yeah, it kinda grows on you.  Actually, I wanted to finish talking to you about uh, spring vacation.",neutral
"No, it's ok! Made me feel like a rock star!",joy
"Yes, but y'know what?",neutral
"And hey, here's to a lousy Christmas.",joy
"No, no, ok, you hang up.",joy
And-and-and I wrote a song for us!,joy
Thank you.,neutral
There’s not gonna be a wedding. Ross and I are not getting married.,sadness
Okay! We’ll need a six-pack of,neutral
I think it just fell off.,neutral
Olé!,joy
"Oh no-no-no, no. No, no, no, I just, I just need a pretend ticket.",neutral
I’m gonna get coffee.,neutral
"Okay, we’ll be right in.  So ah, did your boss try to slap you again today?",neutral
"Ah, just one other thing.",neutral
"Oh, so you're saying you'd choose convenience over health?!",disgust
"Right, oh yeah.",neutral
Kiss me.,joy
"Wow. Oh, I am really flattered, but I just I don’t feel that way about you.",surprise
It’s actually going to be just family.,neutral
Are you serious?!,surprise
What?,surprise
"What rule? There's no rule, if anything, you owe me a table!",anger
Yeah. You won't be able to take it.,neutral
I’m calling for Monica Geller.,neutral
No. And I don’t think I’m gonna want to.,surprise
"Hey, it's Janice.",neutral
Ohhh! That is soo sweet!,joy
"But, it's only the second day and I'm a loser with stupid leather pants that don't even fit!",disgust
"Go little boy, go!",anger
"Hey, have you figured out a way to tell him you’re moving out?",neutral
It’s better! You can’t go to a museum in your underwear!,joy
"I know Mona, just hear me out.",neutral
You want some help with that?,neutral
"Well, not really.",neutral
"I’m having lunch right here, with my good friend Joey, if he’ll sit with me.",neutral
Yeah baby!,joy
"Oh, I’m sorry. You wanna bite?",surprise
"And Monica, with that snort when she laughs?",anger
"You’ll wear that. We’ll be eating, and of course, you’ll be wearing that.",neutral
"It's a money thing, we don't have any.",sadness
So?,neutral
"Well, umm, my Mom’s friend, Phoebe, is actually my birth Mom.",sadness
"Did anybody else feel they just wanted to peel the skin off their body, to have something else to do?",disgust
Men are here.,neutral
Just tell me how.,neutral
Be mad at him!,anger
Thanks.,neutral
It doesn’t matter because nothing beats a three and a six.,joy
With who?,neutral
Deep Impact,neutral
I'm just gonna go flush myself down the toilet now...,disgust
"Oh, I can't tell you how great it was to look at the crowd and see your face!",joy
Oh my god.,surprise
Okay man.,neutral
"Listen, Robert’s gonna be here any second so, will one of you just tell him?",neutral
It’s perfect.,joy
They put you in jail?,surprise
Ball? There is no ball.,anger
I rode a bike!,joy
"Stop with the broom, we're not making noise.",neutral
"So you might say, the ring is irreplaceable?",surprise
‘Cause this is what will happen when you and I have babies!,neutral
"Now, maybe I would have a problem with this if it wasn’t for me and Joshua.",neutral
Fine. You’ll-you’ll watch it on video when we get back.,neutral
We have to do something with it.,neutral
"Joey, just-just he-he’s new in town and I know he doesn’t have any guy friends.",neutral
Let’s give it a shot.,neutral
He may think I’m sick.,neutral
"Well, there's no way I'm gonna get a shot.",fear
"Well ah, actually...",neutral
"Yeah, well you’d be better if you just loosened your hips a little.",neutral
Uh-huh.,neutral
Absolutely!,joy
And I can't stop you.,neutral
"(Singing, to the tune of",joy
"Now, this is last minute so I want to apologize for the mess. Okay?",joy
So I won’t get nervous talking in front of people.,neutral
It’s over.,sadness
"What people think or how you feel, huh?",neutral
"Yes. Well, Mr. Kostelick wants you to stop by his office at the end of the day.",neutral
Are you all right?,neutral
‘Kay!,neutral
Tequila!!,joy
Is there any chance you didn’t see that?,neutral
I was,surprise
"Hi, honey.",neutral
Hi.,neutral
"The movie theatre, you used to come in all the time.",neutral
She was?,surprise
Ross!,surprise
Doesn't anybody understand that I'm gonna be having babies soon?,surprise
"No, I mean, come on, seriously think about it, we get married, we’re up at the altar and I’m like this.",neutral
What am I going to do?,fear
They're brother and sister!!!,surprise
"-she, of course, she- uh- familiar with our.. special situation?",neutral
Let me see the earrings.,neutral
How ya doin'? Welcome. Good to see ya!,joy
I don’t think this number’s right!,sadness
"Goodbye, baby.",neutral
Good.,neutral
"Oh, actually I sorta have plans.",neutral
And a nice hot cider for Monica.,neutral
What?! You’re going out with her again!,surprise
Now what is Fabutec?,neutral
Are you crazy?,anger
"Hey Rach, have you seen Charlie anywhere?",neutral
Wow! This looks great!,joy
"Oh no, I’m sorry, you look a lot different from the last time I-I saw you.",surprise
"Can we please focus here, a naked man’s life hangs in the balance!",fear
That was you?!,surprise
Here you go Phoebe! Here you go Phobo! Phewbedo! Phaybobo.,joy
Come on.,neutral
Nobody is gonna be staring at the bride when the father of the groom is wearing a back-less dress.,disgust
"Oh yeah. First off all, chasing the Churo guy isn't jogging.",disgust
"I'm really gonna miss this apartment. Y'know, Ben-Ben took his first steps right over there.",sadness
Ugh.,disgust
Y'know they say a watched pot never beeps.,neutral
Lusts of the flesh.,neutral
The musician right outside the restaurant...it's kind    of a mood-killer!,sadness
You still love me.,neutral
No. No. No. She lives on the,neutral
"Well, I'll tell ya I do enjoy guilt, but, ah, it wasn't me.",anger
"Thanks, I’m set. Do you still live with your parents?",neutral
That’s not why you’re going!,sadness
"Oh! No, I-I think I just had a contraction.",surprise
Crew guy.,neutral
"No! Joey, you’re going to be great!",neutral
"Oh, I’m sorry. I didn’t hear you over all the winning.",joy
Now couldn't you just have made some sort of inappropriate joke?,anger
Okay.,neutral
"I think I can take care of myself, I’ll talk to you later.",neutral
Remember that guy that gave me a bad review? Well…  I’m getting my revenge!,anger
"Ooh, I love that place!  So, no.",neutral
"Excuse me, Doug?  Hey there sports fan!!",joy
Now just tell Emily that I love her and that I can’t imagine spending my life with anyone else.,anger
"All I have is, is oregano and a",neutral
"And I thought I would bring them to you, y’know, in bed.",neutral
"Hello, Mrs. Chatracus.",neutral
Yeah. What-what did Tag say?,neutral
"Ah… Hey, so this roommate of yours…is he good looking?",joy
"Would you excuse me, please? I'm trying to have a date here.",anger
"Hey, do you think...would it be too weird if I invited Carol over to join us?",neutral
Hey guys.,neutral
You slept with the stripper?,surprise
"Hey pal, are you Joey Tribbiani?",neutral
"Oh-oi-ho, yeah!",joy
Oh-oh!,surprise
Hey Monica!,joy
Oh my God! What were you doing in a library?,surprise
"Ok, ok, so you're not a fan, but I mean, come on, you cannot do this to her.",sadness
"What, what, what is it with you and this holiday?",anger
"I don’t know, I’ve never had to use the other one.",neutral
"Yeah, but only a genius would swallow a sonic blaster gun.",neutral
Now that is funny.,neutral
"Okay, cause when-when he said, ""I can’t wait to hear your first words,"" I thought, ""There’s a trick.""",surprise
"Oh Monica, we are so sorry.",sadness
"I know, it is isn’t it?",joy
"The bottom line is, smoking is cool, and you know it.",neutral
And you're gonna want him to eat his heart out so you're gonna have to look fabulous!,neutral
I just saw Danny getting on the subway with a girl and he had his arm around her.,sadness
Fine.,neutral
That sounds great!,surprise
I can’t watch!,fear
"Really? So, you're gonna stick with this 'it's all for her' thing?",neutral
"Man, that's some",surprise
How about you?,neutral
"You guys are messing with me, right?",surprise
"We can, we can go to Aruba!",joy
Now he's gonna be the guy she goes too to complain about you.,neutral
"Well, it’s about time.",anger
"But that's okay, no problem.",neutral
You-you're the one who's been telling me to get over Ross and move on.,anger
"Ohh, the-the Foster puppets!",sadness
Y’know it wouldn’t kill ya to respect your wife’s privacy!,joy
"Well, we believe it originated here.  In the Aroma Room.",neutral
Yeah...,neutral
"Listen, I know this is your party, but I’d really like to the number of museum geeks that are gonna be there.",neutral
"And he's being Mr. Joe Sensitive, and she starts thinking 'Maybe this is the guy for me, because he understands me.'",disgust
"This is such a great party! 35 years. Very impressive, do you guys have any pearls of wisdom?",joy
"Oh, that's attractive.",neutral
Oh God!,surprise
"Oh, ah, tour guide at the museum. Yeah, Ross got it for me.",neutral
"Okay, they're just talking...",neutral
"Perhaps, you would like me to turn like this,  so that you can bunny bump against my back.",neutral
"Yeah, we talked and Monica made me see that I over reacted a little bit and some things in life are more important.",neutral
"Yeah, we look great together.",joy
Alright?,neutral
Which one do you think she is?,neutral
Noooo!  I'm lying. I am so drunk.,joy
Yeah.,neutral
"I want to let her know that there was a cancellation and if she’s still interested in having the Bing-Geller wedding at our facility, it is available",neutral
"Hey uh, have you guys scene Chandler?",neutral
Y’know?,neutral
What?!,surprise
Oh yeah? And who do you like?,neutral
"No, what did, that was really sweet.",joy
So now I have to go so he'll think that I'm totally ok with seeing him!,joy
He deserves to have all the information and then he can make an informed decision.,neutral
"Well then we’d be in a lot of trouble, you don’t know where any countries are.",neutral
"Okay, okay, here she comes!  How do I look? Do I look like a guy who doesn’t want to get married?",neutral
What?!,surprise
"Yeah, well you never have the time. I mean, I don’t feel like I even have a girlfriend anymore, Rachel.",anger
I just thought the two of us should hang out for a bit.,neutral
Why are you here?,surprise
Oh God.,surprise
"Yeah and the most important thing is that it won’t be some like, stranger up there who barely knows you.",joy
Listen I uh…  It’s a scary world out there especially if you’re a single mom.,fear
All right where’s that turkey!,neutral
Which puts,neutral
How needy do I want to seem?,neutral
"Umm look, you’re coming on a little strong.",fear
"Okay, we'll be here!",neutral
So you don’t know that’s,neutral
"Fine, but I’ll have you know that once I taught him that stuff he called me Fun Aunt Rachel.",anger
Still?,surprise
Well it’s just while Monica and I were dancing to them it was…the first time I knew that…you were the woman I wanted to dance all my dances with.,joy
What’s with all this sand?,surprise
The last candle's about to burn out.,neutral
I?ve got some bad news.,sadness
It's Danny.,neutral
"Your liking it, huh?",neutral
"I mean, last year, I spread a little joy but not really enough.",joy
I’m not even scared to tell mom and dad.,neutral
What’s going on?,surprise
"Like uh, maybe we could get him to get tickets to another Knicks game and invite him.",neutral
It’s so hard!,sadness
"Okay. And uh, are you married.",neutral
Careful of the angle.,neutral
"Umm, nothing. I mean, I’m getting married next week.",neutral
"All right, I promise. I’ll fix this. I swear. I’ll-I’ll-I’ll-I’ll talk to her.",fear
Everything on your application looks really good—Ohh!,joy
Kinda... spooky without any lights.,fear
I just like him so much that I just feel like I’ve had 10 drinks today and I’ve only had six.,joy
And I loved being Fun Aunt Rachel but I’ll go back to being Boring and Uncomfortable Aunt Rachel if that’s what you want!,anger
Bwah-hah-hah!,joy
Hey!,neutral
"I hang out with you guys, and he stars in a drag show in Vegas.",disgust
"Oh it’s Bing, sir. I’m sorry , I was just ah...",fear
Let go!,anger
"I’m torn, between my integrity and my desire to avoid a beating. But I must be honest, your soap is abysmal.",disgust
"Well, I’m sure they’re still somewhere here in the hotel. I’ll-I’ll help you look for them.",neutral
"Hey, somebody left their keys.",neutral
"Oh, that is so unfortunate.",sadness
"Uh, listen, I just wanna thank you for this great opportunity.",joy
Fine!,anger
"Okay, y'know what, you don’t have to do that now.",neutral
"""Pheebs, can’t make it, got a date. Talk to you later. Big Daddy.""  Big Daddy?",anger
Kristen.,neutral
"Nine months from now we can be here, having our own baby.",joy
"Ohh, you and your ways.  Since it’s Christmastime. I’m going to be one of those people collection donations.",joy
I know.,neutral
Horny bitch.  No! You’re a horny bitch! Noooo! You’re the horny bitch! No! You’re a horny bitch!,anger
"Maybe they can take the needle and thquirt it into my mouth, you know, like a thquirt gun.",fear
"Look, I-I-I am sorry that Rachel dumped you ‘cause she fell in love with that Mark guy, and you are the innocent victim in all of this, but don’t punish your friends for what Rachel did to you.",neutral
"Oh, God, just do it!  Call her! Stop being so testosteroney!",anger
Nothing at all.,neutral
What?!,neutral
Okay. Let’s use this brush.,neutral
"No. Joey, she",neutral
Yeah! Richard!,anger
"Oh. Thank you. Ohhh, thank you very much. Oh, thank you for coming.  Uh, just a second!",joy
"Ohh, God.",sadness
"Joey, we have something to tell you.",neutral
Oh so-so not really never.,neutral
"Uh sir, may I see your tickets please?",neutral
How's the maniac?,neutral
That's different! I was drunk and stupid!,anger
Well you can have the suite if you want.,neutral
"Well Joey, we’re all…we’re all very proud of you.",joy
You always said I'd make it.,joy
If you have the big apartment you have to deal with people coming over all the time.,neutral
I knew I shouldn’t have mentioned it! That’s what I wanted to name my kid!,sadness
Well that's not a third nipple.,neutral
"Op, but the twelfth brings a lover’s spat.",surprise
Still.,neutral
We don’t care about where we stay.,neutral
This poor guy’s been in a coma for five years. It’s hopeless.,sadness
"But that's okay, no problem.",neutral
I mean if you hadn’t initiated it I-I-I know I would’ve.,neutral
We have to assign heads to something.,neutral
Yeah!,anger
"Now, I look around this cafeteria, and y’know what I see, I see-I see division.",sadness
"Oh, I must’ve said that after you left.",neutral
That is true.,neutral
"Oh, great!",joy
"All of a sudden, Leon, the manager, calls me into his office.",neutral
I came to give you this  and this.,neutral
"Oh, classy.",disgust
"You gotta help me out here, you gotta set me up, you gotta get me back in the game.",fear
"Well, let's just say the impressions you made in the butter left little to the imagination.",disgust
How could I have left them in the copy room?,neutral
It was.,neutral
Phoebe! Rachel! It’s Monica! I wonder what you could possibly need me for on such short notice!  Oh.,joy
"No, no Pheebs you-you must be mistaken, because I know you wouldn’t schedule a date on the same night you have plans with a friend!",surprise
Hi!,anger
How do you know?,fear
Okay.,neutral
"Hi, I’m Eric, I’m gonna be Chandler’s new roommate.",neutral
"No, I-I-I-I don't, I actually don't know",fear
Go get ‘em Treeger.,neutral
"You have a very impressive resume, Ms. Green. I especially like what I see here about implementing a new filing system.",joy
I wasn’t gonna walk all the way back down here with one shoe!,neutral
You got Rachel pregnant?!,surprise
Why don’t you tell me something I don’t know!,anger
"Look, I know things have been a little tight since Janine moved out.",sadness
"So, you’re just Bing?",neutral
Actually you were a big help tonight.,joy
Wait!,sadness
Oh no! No!! My hole!!,surprise
We’ll-we’ll take stuff from mine and whatever we can pass off as hers we’ll-we’ll put ‘em in there.,joy
But you haven't even heard the chorus!,neutral
"Uh, Paul’s Café. They got great food and it’s really romantic.",neutral
So what?! That doesn’t give you the right to ditch me!,anger
"Hi, Joey. Well well, look what you brought. Very nice.",joy
"Oh Jim, Jim Nelson I’m Phoebe, Phoebe Buffay. We certainly have been seeing a lot of each other lately.",neutral
Setting rattraps,neutral
I found a dried up seashores.,neutral
"But as far as increasing security, I’m afraid the library is very understaffed.",neutral
Storming out!,anger
"Oh, hey, hey, I got that.",neutral
Thanks Rach.,neutral
No.,neutral
Oh yeah right there!,joy
"I don't need an actual man, just a couple of his best swimmers.",neutral
"Yes, and we'd appreciate it if no one told him yet.",neutral
No we,neutral
"No, no! Give it to me!",anger
"And we’re gonna go out, we’re gonna have a good time, and take your mind off of childbirth and c-sections and-and giant baby heads stretching out",joy
"Look, I-I’m really sorry I let go of the bike.",sadness
You guys make a,neutral
"That’s why I take such good care of my teeth now, y'know, it’s not about oral hygiene, I floss to save lives!",neutral
"Oh, is the play over?",neutral
"Yeah, I mean whatever.",neutral
"Oh that was yours? Uh, yeah, we used it when the duck was throwing up caterpillars.",sadness
"Okay, now uh, in terms of the invite list, I’ve got you, me, and Chandler and I’m gonna invite Gunther ‘cause, well, we’ve been talking about this pretty loud.",neutral
I never thought I’d be able to do that!,joy
"Joey, can I talk to you for a second?",neutral
"Ok, and I have the, uh receipt for my dinner with Nokululu Oon Ah Ah.",neutral
"Oh, thank you!   What’s going on?",joy
Well you have to because maybe it’s stupid.,neutral
Why? Why can’t you go to him?,surprise
"Now all you have to do is just get through a little bit more, okay?",neutral
"Yeah, I would’ve except I had a big spaghetti stain on the other side.",neutral
Are you kidding?,surprise
"Me? I'm fine, fine. I'm glad you're here. ...What's with your hair?",anger
"Okay, make sure you look both ways before you cross the street.",neutral
Is this because of the burrito thing?,sadness
"But, it’s gonna be okay, because as of tomorrow I’m conducting an experiment, and if all goes as planned, my butt will be smack free.",neutral
"So it said that by the year 2030, there'll be computers that can carry out the same number of functions as an actual human brain.",neutral
Oooh it’s getting close!,joy
Oh my God.,surprise
"Monica, can I talk to you behind my menu, please.  What are you doing?",neutral
"All right Miss Green, everything looks fine... Yep, I think we're starting to see some real progress here.",neutral
"How about a hammer, or a small blade?",neutral
It's the next day!,joy
"What, Phoebe, did you whip the potatoes? Ross needs lumps!",anger
"So uh, who’s your photographer?",neutral
"Oh, and he’s got such a good heart! Doesn’t he have a good heart?",joy
"Hi! I’m so glad you’re here, but it’s gonna be a while. I-I wished you’d called first.",joy
Maybe it was the guy.,neutral
So what are they doing?,neutral
"Well, actually I got a little bit saved for you Pheebs.",joy
"I'm sorry, my friend Phoebe...",sadness
"Ahh, come on! Y’know what—y’know what, I think I’m just gonna go home and call Kathy.",neutral
Y’know what? It doesn’t matter! Because it is not true!,anger
The little jail between the doors!,anger
"When I first moved to the city, I went out a couple of times with this girl, really hot, great kisser, but she had the biggest Adam's apple.",disgust
"Oh-oh! Okay, she’s kicking!",joy
That’s because their nerves are probably deadened from being so stupid.,anger
"Yeah, all of us! All day!",joy
"Yeah I can, it worked real well.",neutral
For a walk.,neutral
"Yeah, you made me feel really guilty about goin’ out with that girl!",anger
"Okay, come on, I can't get married until I get something old, something new, something borrowed, and something blue.",sadness
"So that’s dumb what I said, don’t tell him I said that.",neutral
Ahhh..,anger
