"Oh, well we watch it a second time and its",neutral
"Ah-ah-ah, now you started this, you will finish it.",anger
"I'm telling you, something's wrong! My brother does not stay out all night.",fear
Well it’s just while Monica and I were dancing to them it was…the first time I knew that…you were the woman I wanted to dance all my dances with.,joy
Did you see that?,surprise
"I know that switch does something, okay?",neutral
Oh God.,surprise
Hi!,joy
Yeah! That’s why I’m sleeping with him on the side.,sadness
Oohh!! Ohh! Oh-oh-oh! Oh-oh!!,surprise
"Oh, what was that for? Like a bake sale?",surprise
Do you want a date Saturday?,neutral
You just told me that he hates marriage!,surprise
"Well, is it, like, a little annoying, or is it like when Phoebe chews her hair?",neutral
Well you’re whippin’ so slow! Can’t you do it any faster?,anger
I'd like to propose a toast.,joy
"Aw, you’re right, you’re right. I’m sorry.",neutral
"All good, thanks.  Do you maybe have a nickname have like a nickname that’s easier to rhyme?",neutral
"Phoebe, I asked you to guard the ring!",anger
"Well, at least she had the chance to leave a man at the altar...",joy
Nobody!,anger
"Oh uh-uh yeah, I think that…",neutral
Bastard!,anger
Yeah. Hate him.,disgust
"Joey, I am scared to death about this.",fear
I’ll be right with you.,neutral
Okay!,neutral
"It really has been great too, you know, some of this people    must have seen me play before because they were requesting a bunch of my songs!",joy
"No! No! Phoebe, come on! I don’t want to switch! Please come on! I can throw wet paper towels here!",sadness
Yeah!,joy
That’s…kinda hot.,surprise
Oh!,surprise
Thanks.,neutral
"Ok, I know this is gonna sound really stupid, but I feel that if I can do this, you know, if I can actually do my own laundry, there isn't anything I can't do.",joy
"Carol, Kristin.",neutral
We’re still married! Don’t tell Rachel. See you later.,joy
Does that mean the same thing in England as it does in America?,sadness
No but at Monica’s you can eat cookies over the sink!,joy
It's that whole sensitive thing.,neutral
Here comes the bride.,joy
I'm sure they'll be here soon.,neutral
You should! How is she?,surprise
But what choice did I have. He was keeping my sister    in a,anger
What?,surprise
Yes you did! What was it?,surprise
"Because! Because, it-it-it’s… It’d be like you having this guitar  and-and never playing it. Okay, this guitar",anger
"No-no-no, I think I’m gonna see how things go with Kathy. She’s pretty cool.",neutral
"Well, can you blame her?",sadness
I bet it’s fast.,neutral
Well how about this one? Testing the effects of Joey Tribbiani on attractive nurse receptionists.,neutral
You are so cute! How did you get to be so cute?,joy
This is basically the first time she's gonna see your underwear—you want it to be dirty?,surprise
I am selling cookies by the case.,joy
"No, no, Mr. Heckles no one is making any noise up here.",neutral
Hey.,neutral
"Flowers of Evil, by Beaudalire. Have you read it?",neutral
Fine ... mediocre porn,neutral
"Ross I’m so sorry. Okay. I-I will promise I will straighten this out with him tomorrow in person, or via e-mail.",sadness
You two could really hit it off! I'm gonna go mingle.,joy
"Nothing, nothing.",joy
Oh no! No! No!,surprise
Yeah? You like that one?,surprise
Okay.,neutral
Who?,neutral
You guys got anything to eat? I just went down to Johnos for some chicken and it was closed!,surprise
"Why, do I have a feeling that’s not as happy as it sounds?  No! Nooooo!!!",fear
You what?,surprise
"Yes. Yes, there is, they play on Sundays and Monday nights.",neutral
"Have I read it?  No, are you enjoying it?",neutral
"Well, that was ah...",neutral
And...?,surprise
"Hey, buddy.",neutral
Emily!,joy
"Look umm, of all people, you do not want me to tell this story!",anger
"Okay, Raymond, Joey you're up.",neutral
No.,neutral
"Come on man, you-you got to give me a second chance!",sadness
"Um, I've got something in my eye, uh, Joey, could we check it in the light, please?",neutral
"Well okay, so then you’re fine.",neutral
"Let's see, she's on the third floor",neutral
"A real man wouldn’t just run to the hospital!  No! What would, what would Krog do?",anger
"Hello, Susan.  Good shake. Good shake. So, uh, we're just waiting for...?",anger
Ooh! How about Agamemnon?,neutral
I'm just gonna go over there and confront them right now!,anger
No.,neutral
"Whoa!! Now look, don’t be just blurtin’ stuff out. I want you to really think about your answers. Okay?",joy
"The next time you want to dump a fire alarm in a trash chute, don’t wrap it in a blanket that says, ""Property of Phoebe Buffay not Monica.""",disgust
What?! It is?!,surprise
My agent would like to know why I didn't show up at the audition I didn't know I had today.,anger
I'm Joan Collins.,disgust
Oh my God! I do love you! How did you do it?!,joy
Go!,anger
"Ah-ha, nowhere to run!",joy
"Y’know Joey, I could teach you to sail if you want.",joy
Yes that would have made more sense.,sadness
"Ugh, well I will just have to soak up every once of Chandler Bing until that moment comes.",sadness
Okay.  Every time.,neutral
I'm..,neutral
"Ooh, is that spelled with a ‘C’ or a ‘K’? Oh my God! It doesn’t matter; they’re both great!",joy
Paris?,neutral
Oh.  It’s just so unexpected! I…I uh…Boy I’ll tell you it’s just such an honor to be nominated for a,joy
Why not?,neutral
Hello Skidmark.,neutral
There’s nothing wrong with a woman enjoying a little…erotica.,neutral
"Oh, that's attractive.",neutral
"Well, I lost.",sadness
He touched my fanny.,anger
Tell me about it!,neutral
Won't you dance around with me.,neutral
"Ooh, I have to tell you something.",joy
"Oh my God, they told us that was for the mascot!",surprise
"Well, we called everyone in your phone book and a bunch of people came, but it took us so long to get you here that they-they had to leave.",neutral
Me too.,neutral
Are you looking at her?!,anger
She’s in labor! You like that you sick son of a bitch!,anger
I-I'm sorry! Sorry.,fear
Hey! How you doing?,joy
"Oh, yeah.",neutral
You need to give him money.,neutral
Oh my God!,surprise
"Stop saying, ""Blood"" to strangers.",sadness
You couldn’t do it?!,surprise
Oh God...,fear
Would you stop?,anger
Why?,surprise
What? What happened to the window in the attic?!,surprise
"Oh great! What, you brought Joey?",joy
"Listen, you know how uh, when you’re wearing pants and you lean forward I check out your underwear?",neutral
"Oh, and the director is supposed to be the next next Martin Scorcese.",joy
Oh wow!,surprise
I can’t figure this out!,anger
"‘Cause I kinda all ready told her uh, it was, it was already taken care of.",fear
"Uh, I’m just, I’m just looking out your window. At-at the view. What are you guys doing?",neutral
This was fun! But I've got an invasive vaginal exam to get to!,joy
Umm,neutral
Are you're hands still wet?,neutral
Can you hold on a moment? I have another call.  I love her.,joy
Thank you so much.,joy
I think I left a donut up here.,neutral
"Hey-hey-hey-ho-ho, I got this one.",joy
"Ooh, let’s see it!",joy
How did it go?,neutral
"All right. Uhh, international.",neutral
"Oh, Pheebs, Pheebs...",joy
"I think we should call Ross, maybe he can get a car and come pick us up.",neutral
"Okay, I hear you! Are you capable of talking about any thing else?",disgust
"All right, I have one question.",neutral
"So this year, I’m going to do the whole city.",joy
"Well, I’m not gonna talk because",neutral
What did you just say?,surprise
Uh-huh.,neutral
But you gotta have turkey on Thanksgiving!,joy
"Oh honey, I'm so sorry, you were right, this feels great!",joy
See what you did.,anger
"All right fine, don't do anything, just sit here and talk to us, meanwhile she is talking to him about you.",disgust
No leg-chewing for us sir.,neutral
"Anyway, I-I still think we should try to patch things up, y’know?",neutral
"Oh please, could she",neutral
Huh.,surprise
"Oh, that’s, that’s ah, one of the old ones, he’s just taking it to the back.",neutral
What do you say?,neutral
"Ok, Caravaggio uses chiaroscuro here to highlight the anguish    of the central figure. Touch it, it's really bumpy! .",neutral
It's the next day!,joy
OK... my weirdest place would have to be... the women's room on the second floor of the New York CIty public library.,neutral
"Guess who's here. It's the toughest guy in toy land, Ben.  'A real American hero. I'm",neutral
"Don't go anywhere, I'll be right back.",neutral
"Hi, here's the deal.",neutral
"Ross, I am a human doodle!!",anger
All right everybody! Everybody guess what? I just convinced Paul to give us a test next week!,joy
"Ok, now, remember, no trading.",neutral
I’m all done.,neutral
"Yes! Now, she feels terrible! She really wants to make up! You gotta find her.",anger
Hey!,neutral
Because I sure as hell can’t figure it out!,anger
"So, see ya on Saturday.",neutral
"It turns out they fired the head lunch chef, and guess who got the job.",joy
Oh... Milwaukee.,neutral
"Yeah, you’re funny.",joy
She might be able to do better.,neutral
Yeah! No that's what I was thinking.,neutral
"Don't look now, but behind us is a guy who has the potential to break our hearts and plunge us into a pit of depression.",neutral
oooooooooooooohhhhhhhhhhh,surprise
I am so sorry...,sadness
Did you just flick me?,anger
My favorite part was when,neutral
You told her before you told us?,surprise
Hey.,neutral
She just called and said that she was gonna be working late!,anger
I'm smarter than,neutral
Ok!,neutral
"Okay, you guys, just relax.  I doooo.",neutral
Good.  I should really start wearing hats!,neutral
"Umm, all right Wayne, level with me.",neutral
"No, no, no, don't you dare bail on me.",anger
Come on!,joy
"Oh-ho yeah! A song with rhyming words. Oo, I never thought of that before.",anger
No. Not anymore.,neutral
Because we won our apartment back!,joy
This is unacceptable Rachel!,anger
"And he’ll bring you some cold soda, if want you need him for is that you’re really hot.",neutral
"Hey, you know our phone's not working?",surprise
"Right...  ok, so just from the top of the page, right here.",neutral
I didn't wanna leave him alone.,neutral
"All right, look, if you insist on wearing that, in public, y’know, you’re gonna spend the rest of the afternoon all by yourself.",disgust
"God, he's good.",joy
Crazy lady thinks her mother is in a cat.,sadness
"Oh, that's Nana, right there in the middle.  'Me and the gang at Java Joe's'.",neutral
"Okay, you have 19 questions left. Use them wisely.  Come on Joey! You can’t win if you don’t ask any",joy
"Hand me those tomatoes, I’m gonna show you what it should taste like! Come on, hand me them.",anger
"Oh Monica, listen, I ah, I saw down at the hardware store, they got those designer tiles on sale.",neutral
I really wish that you wouldn’t.,anger
"Okay lady, you're out of here.",disgust
"Well, she’s out of town so, there’s gotta be something in her house that tells me where my Father is.",neutral
May I see it?,neutral
"Umm, look I like you.",fear
"No! No sir umm, she means a lot to me. I mean, I care—I-I love Rachel.",fear
"Hey, Mon.",neutral
Go!,anger
That’s it?!,anger
Yeah baby!,joy
You're sister? You're sister's asleep on the couch?  Ohhh! I saw,surprise
"Well, why don’t you tell me what you’re supposed to be!",anger
"I was going to tell you, but",neutral
"On the other hand, if she wasn’t kidding, she’s not fun, she’s stupid, and kind of a racist.",anger
"No. I’m just, I wanna, I need to be alone.",sadness
I’m gonna call the landlord and tell him that Monica is illegally subletting here grandmother’s apartment.,anger
Half a tank? We still got a lot of high-speed chasing to do!,surprise
"Y'know what, hold on, let me go get Chandler.",neutral
Let's try scooching!,joy
"Liam, do me a favour. Tell the lads to go easy on Ross, it’s his first time.",neutral
"Hello, I am Guru Saj--Whoa!!  That’s supposed to be a duck right? ‘Cause otherwise, this is waaay out of my league.",surprise
"All right, gimme your foot.",neutral
"Hey, how'd it go?",neutral
Yeah.,neutral
"Yes, I know, but her friend sounds like such a...",anger
I like funny.,joy
"She'll say ""No"", David's heart will be broken, it will be too hard for them to recover from and then Phoebe will end up alone",anger
I don’t have too. I can just look at you.,joy
"Okay, okay, bye",neutral
"Okay, you’re fine.",neutral
Fabulous.,joy
You got problems because of you!,anger
...Oh God.,fear
Oh really? That’s how treat a friend? You get her in trouble and then refuse to marry her?,anger
"Okay, look, I think we have to tell Rachel she messed up her dessert.",neutral
"This is such a great party! 35 years. Very impressive, do you guys have any pearls of wisdom?",joy
Who?,neutral
Good morning.,neutral
Hey Pheebs!,joy
"It’s-it’s, they’re-they’re wearing it in Milan, so part of my job is too wear the clothes, and then I see how people respond, and then I report back to my superiors at",neutral
"What's wrong, sweetie?",neutral
"See, didn't I tell you?! You're getting over Ross already!",joy
We need a porn break.,neutral
Not so fast Wesley!,anger
Pregnant Woman Slays Four?,fear
Hi.,neutral
"Okay, you guys. You guys I think I know what’s going on here. Okay, you guys",neutral
"But umm, you’re right.",neutral
"So! I'm just an empty vase, huh?",surprise
"There's a beautiful woman at eight, nine, ten o'clock!",joy
Was it not pain-free?,surprise
"So, if we could just get back to the lecture.",neutral
He didn't get the goggles!,surprise
"Monica, betting the apartment, I don’t know about this.",fear
Why else would I be here?,neutral
And Ross gave me this great book (holds up the,neutral
"Oh, do you need a hug? You don’t have to bring me anything!",joy
That was Joey!,neutral
Man! He just keeps lobbing them up and I just keep knocking them right out of the park!,joy
"Ooh, nice.",joy
No.,neutral
"Yeah, so it turns out that it wasn’t the hair straightener that started the fire.",neutral
I do-I do,joy
This way I can break 'em up with a movie.,neutral
"Yeah, isn’t that a cool name?",joy
What-what is love really?,neutral
Come on!,joy
Whoa,surprise
Danny! Hurry up! The bath is getting cold!,neutral
No. Ooohh,joy
Mark's a genius!,surprise
I can't believe you don't want to know.,surprise
No.,neutral
Here we go!,joy
I mean you don’t have to have this rustic Italian feast.,neutral
So I guess what I'm trying to say is that I'm very thankful that all of your Thanksgivings sucked.,joy
"Oh, ah- the kid has it.",neutral
"Oh, would you look at that Monica?",joy
"Well, you should be, this is all your fault! You meddled in our relationship!!",anger
Wait! Wait! Maybe she’s a hooker,surprise
Cut me a real piece!,anger
"Umm, I am free tomorrow night.",neutral
Oh! You got it?!,sadness
"Ah actually, that is mine.",neutral
What?,surprise
"Umm, okay I would like to talk to you about your toner needs.",neutral
"You look at me, and nothin’.",neutral
Yeah!,neutral
"Excuse me, sir! This lady played my quarter, this is my money.",anger
Call me.,neutral
"No, I don’t want to tell anybody else because I don’t want Monica to find out.",neutral
Wow! If only more people knew.,surprise
"Oh, hey, hey, I got that.",neutral
Hey!,surprise
"When you were talking about Roger, that was killing me!",sadness
I just...,neutral
"Aww Pheebs, that sucks!",sadness
Hey!,joy
Because... I'm Monica Geller. It was my credit card you were using.,neutral
"No. No-no-no-no, no. I mean, don't do that. Not, I mean not for me.",anger
Hey guys!,neutral
"Yeah, I mean, it would be rude to them  for us to leave now.",neutral
Sure!,joy
Who cares? Nobody reads those things,neutral
"Umm, some people eat stuff off one another.",neutral
Get out of the way jackass!,anger
My little sister Dina!,joy
No! Don’t say that! Don’t say that!,fear
"Whoa, whoa, whoa.",surprise
"Yeah-yeah, except Apollo 8 didn’t actually land on the moon.",neutral
"And hey, here's to a lousy Christmas.",joy
"Walls are pretty thin, guys!",anger
"Oo, where are the seats?",joy
I have to say you are a much bigger person than I am.,neutral
"I like waking up with you too.  Oh! It's such a beautiful morning.  Oh, I can stay here all day.",joy
Maybe one of them will break away.,neutral
"All right, ladies and gentlemen, let’s poke.",neutral
Y’know I-I-I haven’t spoken to him in like ten years and he asks me for a favor!,surprise
"So I'm asking you please, take a moment before you judge me.",neutral
"Oh-oh, that’s a risky little game!",surprise
Yeah that's right you are so busted.  Book 'em.,anger
Hi.,neutral
Hi,neutral
Hey!,joy
"Twenty-one hours, you’re a hero.",neutral
"Well, I-I got this blinding pain in my stomach when I was lifting weights before, then I uh passed out and uh, haven’t been able to stand up since.",fear
Would you like to see a semi-private room?,neutral
Why?,surprise
It’s candy time! My roommate says that they taste like little drops of heaven.,joy
Hi!,joy
"Mom, c'mon, stop worrying.",fear
Aw!,surprise
"No, wait! Emily! No, wait, stop! Emily, please—",sadness
"Oh I, I have plans tonight.",neutral
No idea!,surprise
How can you not know which one?,surprise
"I know, the babies are asleep.",neutral
"Oh wow, you didn’t even try to unhook my bra!",surprise
Is he doing his shark attack bit yet?,neutral
"Now, I say we shed these-these coats that separate us, and we get to know the people underneath.",neutral
Then I’m gonna have to ask you to keep it down.,neutral
"There he goes, your fiancée.",joy
What the heck is that?,surprise
Come on! you...,neutral
"OK. Here goes. For a while now, I've been wanting to, um....",neutral
"I mean, I realize that his feelings may never completely go away, but",sadness
What?,neutral
You know what else? He's unbelievable in bed.,joy
"Look he doesn’t have any brothers or sisters, somebody’s gonna have to teach him this stuff!",sadness
Oh my God!,surprise
Should I get her a  Tiffany cut or a Princess cut or a—ah-ah!,sadness
You’ll be perfect for this! That’s already your name!,joy
What?,neutral
"This is completely normal, around the fourth month your hormones start going crazy.",neutral
What are you talking about?!,surprise
Hey! Did Chandler show up yet?,fear
"Oh, I don’t know.",fear
"Yeah! Okay, here you go.",joy
Ohh that’s nice.,joy
He said he's really gonna miss you guys.,sadness
"Yeah, well, you wouldn't think it was cool if you're eleven years old and all your friends are passing around page 79 of 'Mistress Bitch.'",disgust
"I don't want to be single, okay? I just... I just- I just wanna be married again!",sadness
Hello baby girl.,joy
"Yes, that’s very good. Now a uh, big part of this job is cultivating personal relationships, especially with designers.",neutral
"Hey, look at me. I'm making jam, been at it since 4 o'clock this morning.",sadness
There’s a lost and found?  My shoe!,surprise
That's my sister.,neutral
"Oh it's OK. You were worth the wait, and I don't just mean tonight.",neutral
Did you not hear me before when I told you that all of Janine’s friends are dancers?!,surprise
Or not.,neutral
"Instead of hitting on her right away, he's becoming her confidant.",anger
"Okay, good-good for you.",joy
"All right, I'm just gonna go on the date.",neutral
Hey!  What happened to you? Why didn’t you come up?,surprise
Oh! Thank God!,joy
"All right, I guess this will be fine.",neutral
Ben is way cuter than that kid.,joy
"I do Rach. I do, and I so happy for you.",joy
I know.,neutral
And here we have the last of Paulo's grappa.,neutral
He asked you out?!,surprise
Really?,surprise
"Well,fall out of it.",anger
"Yeah, huh.",neutral
What?!,surprise
Stop it!,joy
"Noo, I y'know I don't see why she has to play with you, that's all.",anger
Good idea. Where do you want to go to lunch?,neutral
How you doin’?,neutral
Hi.,neutral
Oh shoot! I work Monday nights.,sadness
"Oh no! That really is nothing, she is",neutral
"Ursula!  Wait! Err-err, it’s me! Phoebe!",surprise
"Oh, me too.",joy
It's a kitchen slash bathroom.,neutral
What?! What else did he say?,surprise
Terry!,sadness
I’m so glad you liked it.,joy
I’m gonna go find that guy’s car and leave a note on the windshield.,neutral
"That’s a good question, dad. That’s a good question",neutral
The only reason she's goin' out with me is because I said I could bring a friend for her friend.,neutral
"Look, I just lost my other job.",sadness
He’s looking at me.,neutral
Hey lady! I don't care how much you want it! Okay?! I am,disgust
That’s what you think.,neutral
"But believe me, that’s not gonna happen today.",neutral
What the hell is that?,anger
So that’s your second marriage in two years.,neutral
"So, let’s talk about women. I’m sure our female readers will be interested to know about your romantic life.",neutral
"Oh... Mike's sister just invited me to a party tonight, he's gonna be there.",anger
You fell asleep!!,anger
Move it! Move it! Move it!! Hey!!! I’m the teacher!!,anger
Isn’t there a national football league.,neutral
"Oh, my god.",surprise
Oh. What do you do?,surprise
But my apartment!,surprise
Hey!,neutral
"Oh, in my head he's done some pretty ""not-gay-stuff""!",neutral
They had to have that specially made?!,surprise
"Now you do that, you’re on TV.",neutral
"Y'know, I don't like to brag about it, but I give the",neutral
This bicep?,surprise
He musta been sweeping. They found a broom in his hand.,neutral
Yeah.  Maybe it’s for the best. You smell just like her.,sadness
Allll done!,neutral
"Although, I have a hint of morning sickness, and I’m wearing underwear that goes up to about……there.",neutral
"First of all, it's on your ass.",neutral
"Well, okay, so what’s now—go get, go get the eggs, put ‘em in there.",neutral
"Nobody wants to do it? All right, I’ll do it myself.",disgust
"And I always figured, when the right one comes along, I'd be able to be a stand-up guy and go the distance, y'know?",sadness
"No, but I was doing my thing and everything was going according to the plan!",anger
Who?,anger
I’ve got five bucks says you can’t.,neutral
You really think so?,joy
Yeah but when he proposed to me with the ring I got goose bumps.,sadness
"They are not breaking up, look at them.",neutral
"Well I’m, I’m a little slow.  Just as our children would be.",neutral
"But ah, hey, oh, somebody’s off the phone, how ‘bout a glass of wine by the fire, I could get it going again.",neutral
And there’s daddy!,joy
"Last time I do that, I promise.",neutral
There’s nothing to handle.,joy
You guys were totally right!,joy
Oh my God! This is it!   I really hope it’s you!,joy
Dude!,surprise
And you promise you’ll get this taken care of right away?,neutral
Yeah.,neutral
I'll go in there.,anger
"I was up all night writing this really nasty letter to Emily! It was perfect and now it's all covered in-in…  Actually, thanks!",sadness
"And y'know, and um, I...",neutral
Let go of my hand!,anger
The Red Ross! Okay.,joy
"So, so, what’d ya think?",neutral
And I suppose you used a ring designer for that.,joy
I’m gonna go down there and teach that guy a lesson.,anger
"No Mon,",neutral
"Are you insane? I mean Joey, is going to kill you, he’s actually going to kill you dead.",surprise
"Well okay, so then you’re fine.",neutral
Clear the tracks for the boobie payback express. Next stop: Rachel Green.,neutral
Okay! We’ll need a six-pack of,neutral
"Actually, I think you’re ready to go to the delivery room.",neutral
"Oh, you so would! Oh, you should get that anyway.  Like for clubbing.",sadness
Big deal!,anger
"Oh don’t worry, I’m not really a party girl.",neutral
All right! Everybody ready to go to the movies?,neutral
Oh! Oop!,surprise
Seven hundred bucks!,joy
in Reservations at 8:00 by Neil Simon.  Thank-thank you Neil. Thank you for the words.,neutral
"No, I’m not gonna pick them up.",anger
Are you looking at her?!,anger
Who knows?,neutral
Still crying?,surprise
If Phoebe were my maid of honor,neutral
Are you excited?,joy
"No, you can't! Friends hooking up is a bad idea.",fear
"I'm only 26, I'm not even thinking about babies yet.",anger
"So I though about what you said and I though about what he said and, well, his way I get to have sex tonight so.",neutral
Handling it?,neutral
I’m from Long Island.,neutral
Oh.,sadness
Can you hold on a moment? I have another call.  I love her.,joy
"Come on Phoebe, look at that!",anger
"Yeah, it’s  mine.",neutral
...And what did you bring?,neutral
Because every time I look at that cover I’m like,neutral
"Hey, you're not rich are ya?",neutral
"""Indeed there isn't""... I should really get back to work.",joy
Uhh….,neutral
Steady.,neutral
Really? They love him down on six.,surprise
"Y'know, when I'm with her, I am so much more than that.",joy
"I know, they’re gonna be",joy
It's worse than the thumb!,disgust
"No! No-no, I love it. Thank you.",joy
"Uh, moist, yeah.",neutral
"So what’s a matter, you need a dentist? I’ve got a good one.",neutral
I don't think so!,joy
You have a son!,surprise
"Ben, I want you to know that there may be some times when I may not be around, like this.",sadness
"Man, I didn't think we were gonna make it!",surprise
That oughta do it.,neutral
"And then also umm, I’d be far away in the sea.",anger
"No, just a Friday night.",neutral
"All right look, you're going to have to go there yourself now, okay, make a few surprise visits.",neutral
Thread the needle.,neutral
"Sweety, now, she’s a woman, not a gumball machine.",neutral
Of course he’s gonna have his Uncle Joey!,joy
Who would you rather sleep with Monica or Rachel?,neutral
What the hell is in there?,surprise
"Mon, look at yourself. You have cookie on your neck.",disgust
"Honey, relax. Ross is great with him.  Don't look so surprised. I'm a lovely person.",joy
Thank you. I'm going to rejoin my dinner party.,neutral
"It’s, it’s, it’s just ah, a coincidence.",neutral
