"Ahh, no.",sadness
"All right, I’m-I’m not English.",sadness
That’s what I do now.,neutral
oooooooooooooohhhhhhhhhhh,surprise
"Look, I don’t think so Pheebs.  All right, I’ll do it. But just because you’re a friend.",neutral
"which brings us back, of course, to Greely’s theory of dominance.",neutral
"Not so good, Simmons and I gave him a wedgie.",neutral
I can never kiss you again when it's all I can do not    to kiss you right now.,sadness
"Hi, hi can I help you?",joy
Let me get it out before it sets.,neutral
I’m Joey! I’m an actor! I don’t know squat about dinosaurs!,joy
"No. No, I just uh, I just loved the way it feels when everybody thinks I own a Porsche.",joy
Uh-huh.,neutral
"This has a little bit of orange peel, but no nutmeg.",neutral
Big Bird's friend.,neutral
"Okay, so I made up a little test.",neutral
I don't know.,neutral
"Oh, I'm sorry. I forgot you had that whole Rachel thing.",surprise
Stay calm?!!,anger
‘Sup? ‘Sup dude?,neutral
"Ross, we…we have to be strong. Okay, I-I’m gonna go.  Can I? To remember you?",sadness
"Hey, it’s my list.",anger
"Well, that?s the part where you tell him that I moved to France. When actually I?ll be in Cuba.",neutral
What?,surprise
"Look at that guy by the window, wow!",surprise
"Joey, why is your cable out?",sadness
I think It's the most beautiful table I've ever seen.,joy
"Everybody else got one, and you want one too. Don’t you?",joy
Not right now.,neutral
Nooo!,surprise
Ross?,neutral
Unagi. I’m always aware.,neutral
The silk? Feels really good!,joy
"No, but Horny for Monica Minister called, wanting to know if we were still together.",disgust
Hi! Phoebe.,joy
Now you know how you really feel about it.,neutral
She didn't feel anything for him.,neutral
"Come on, you think she should go out with me, don’t you?",neutral
Y’know it wouldn’t kill ya to respect your wife’s privacy!,joy
"So do you think uh, Joey’s more charming than me?",neutral
"All right, I'm nine years old.",neutral
"I don’t know, you thought ‘See you Saturday’ was funny.",neutral
"No thanks, Mom!",disgust
"Oh, Danielle! I wasn't expecting the machine... Give me a call when you get a chance.  Bye-bye.  Oh God!",surprise
Yes! Ben learned a little trick.,anger
What'd I tell you? What'd I tell you?,joy
Am I interrupting?,neutral
Nooo!,surprise
That's a good one!,joy
"Hey, both you guys should be up there with me.",neutral
"Ohh, that's so nice! How great! Well, where? Where's the trip?!",anger
Hey!,surprise
One!  No ten! You said ten! You can’t take that back!,anger
It was horrible. They called me chicken boy.,sadness
What if Mary-Angela comes to the door and I ask for Mary-Angela?,fear
"Oh, great!",surprise
"J-j-just relax, nobody yelled. Jack just was calling to make sure that",neutral
It couldn’t have anything to do with the fact that-that maybe I’m a good listener and I uh I put on a,neutral
"No, don’t look directly at them!",fear
I notice that you’ve been trusted with a lot of rather important responsibilities.,neutral
Oh God!,surprise
How ya doin’?,neutral
I see Spindler a lot.,neutral
"Oh no-no-no, it’s only one night a week, and plus I get to take all of you out for a",neutral
‘Cos I was gonna say there’s no way you could’ve done the end the way you guys did it back then!,joy
"Oh, then no.",neutral
Really?,surprise
"Okay, great.",joy
I'm gonna go get one of those  job things.,neutral
"You and I, we're interfacing.",neutral
And this is Rachel.,neutral
"Pheebs, can you help me pick out an engagement ring for Monica?",neutral
"Yeah, I-I-I-I’m funny Ben, but I’m not stupid. Okay?",joy
"Oh yeah, why not?",neutral
He obviously went crazy.,anger
"Okay, I'm not just waitressing.",neutral
"Umm ma’am, do you have a minute?  I kind of have some bad news. I don’t think I can move to Tulsa.",sadness
"Oh, thank you.",neutral
"Well you let me know if you can, because y’know I can bake a pie to cover it.",neutral
"Okay, I’m next.  Don’t! Don’t start another game! I said I’m next! Phoebe!",anger
What? Is it the comet?,neutral
"Hey, ready for dinner?",neutral
"...and he couldn’t let it go, and... I don’t really know what happened with that either.",neutral
I'm back.,neutral
"I mean, it-it was like, it was like he made us into a team.",joy
Hey-hey!,joy
Well we have to make room for the fresh ones.,neutral
Oh! What what what! ...Hi.,surprise
"Now I'm looking at my dad, thinking...",neutral
"Um, see, but that’s not the final draft.",neutral
"Knock, knock, knock, knock, hi.",neutral
"Come on, please?! I’m boredddd! You let me do it once before.",neutral
Oh no. I thought you said they could shoot the spot without you.,neutral
"But, we pick again! We pick again!",joy
"Did you just say Hi, Jew?",surprise
"Ugh, Monica, I know about you and Chandler.",disgust
Sweepin’. Why? Turn you on?,neutral
"Y'know what? I cannot do this with my left hand! Would you please, help me with this too?",anger
"No, you're the best.",neutral
And this is not the only hospital in this city and we have no problem to—Whoa!,anger
"And, oh, um, my friend Larry, he wants me to take a picture of a hooker.",neutral
"So just bring it back downstairs, what’s the problem?",neutral
Yeah.,neutral
"Listen, I know this is your party, but I’d really like to the number of museum geeks that are gonna be there.",neutral
"Okay, then.",neutral
That was unbelievable!,surprise
You're doin' this.,neutral
I will sit with you Dr. Geller.,neutral
What's your point?,neutral
That's great.,joy
Do you remember how he behaved at our wedding?,disgust
You are!,joy
He was unbelievable.,joy
"So, we’re walking down the street and I turn to you and I say, “Hey, let’s go hang out at Totally Nude Nudes,” remember?",neutral
They loved me!,joy
"Well then he gets a divorce, it’s Ross!",neutral
"Now, let’s go out there and get ‘em!",joy
"If you tell me, I’ll tell you what Phoebe said.",neutral
"Now, y'know the bee probably died after he stung ya.",neutral
"I mean for, for all you know I could be a fashion..... monger.",neutral
I don’t know.,neutral
"OK, I'll go. OK, senior year of college... on a pool table.",neutral
"All right, Jester man, look we wanna see the king.",neutral
"Question. You're not dating anybody, are you, because I met somebody who would be perfect for you.",neutral
"No me, I am so sorry...",sadness
God.  I have never been so uncomfortable in my entire life!,joy
Okay.,neutral
Because every time we’re in the room together there’s this weird like energy between us.,neutral
This will be your phone.,neutral
We have so much in common!,joy
I'll tell you what.,neutral
"Op, but the twelfth brings a lover’s spat.",surprise
"No thanks, I have a good one too. I just, I, I can’t see him.",fear
Why?,surprise
What woman?!,anger
"Ah, we’re out. I sold them all.",neutral
That saves us a conversation.,neutral
Hey! Any good mail?,neutral
"Carol, we've been through this before, ok?",joy
I don’t think you have much choice.,neutral
What?!,surprise
Wow that was a big one.,surprise
"Yeah, okay let’s leave these two alone.",neutral
I think he's shy.,neutral
Come on.,neutral
"Yeah, it’s hard okay, I only have two spots left.",neutral
"David the scientist guy, David that I was in love with, David who went to Russia and broke my heart David!",sadness
Manhattan does not have enough stores.,sadness
I do?,surprise
Wait!,sadness
I'm sorry you had to do this by yourself.,neutral
"Yeah. Yeah, that’s what you need a good…pill.",neutral
Hi guys!,joy
"Do you ah, want to get her something speacial, get her flowers, get her candy, get her gum, girls love gum.",anger
"Listen, we both know you’re gonna do it ‘cause you’re not a jerk.",neutral
Hey!,joy
"By then, the cheesecake may have gone bad. We don’t want her to come back to bad cheesecake.",fear
Went down to the docks. Bet ya didn't know you could get it wholesale.,neutral
Hey P,neutral
"Then I called 9-1-1 and they laughed at me, if this isn’t an emergency, then what is?",anger
"I but—y’know I’m gonna go out with him again, I’ll find out more.",neutral
Oh I’m sorry! Do you need a break?,surprise
"Hey everybody, Pheebs is here!",joy
Me neither.,neutral
I wanna say a disease.,neutral
"How could you pick up a hitchhiker?! He could be a rape—, a rapist or a killer or something!",fear
"Okay, I can do that! Oh, by the way, I",joy
It's all right.,neutral
"But um, I don’t think it’s anything serious.",neutral
"Oh, y-yeah, so, you-you love me!",surprise
"I know. I know. But, can we please try it again? Huh? I mean, you were",sadness
"I dunno, there's just something about...",neutral
"Ohh, so cute.",joy
They didn’t take any of my suggestions!,anger
My God! What did you order?!,surprise
Your friends are outta here pal.,anger
Where'd you get fruit at four in the morning?,surprise
Hi.,neutral
And now I have seen her naked.,neutral
He was my first client when I became a party planner.,neutral
I think I know that girl.,neutral
Hey! Hey! No rough holding in my ER!,anger
"Okay, so now do you believe that she's attracted to me?",neutral
"""We were on a break!""",anger
Are you serious?!,surprise
"Maybe this would’ve happened if I’d been more nurturing, or I’d paid more attention, or I... had a uterus.",sadness
He started it!,anger
"Umm, I am free tomorrow night.",neutral
"Well, not really.",neutral
Oooooh.  : Oh! I got an interview! I got an interview!,joy
Let me walk you home.,neutral
"Okay, I’m gonna break into this mini-van and put it in neutral.",neutral
"Well, I’d gotten Judy pregnant. I still don’t know how that happened.",joy
I'm gonna go on the date.,neutral
And people say you don’t pay attention.,neutral
And-and a power tie?,joy
Kind of what ‘probably’ really means.,neutral
It made me nuts.,disgust
Mia Hamm?,neutral
Oh! That's why.  I'm sorry!,surprise
Good!,neutral
"Rachel would be Phoebe’s, I would be Rachel’s, that way we all get to do it once and no one would get upset.",neutral
Lebanon.,neutral
They-they have a liking problem with you.,sadness
Maybe you can tell me.,neutral
"Uh, Pheebs? Who's George Snuffalopagus?",neutral
Hey! It’s starting to snow.,sadness
"No-no-no. I don't have a son named Jordie. We all agreed, my son's name is Jamie.",anger
Exactly.,neutral
"Hey, Rach! How ya doin’?",joy
I'm not fine. Here she comes.,fear
I like her.,neutral
Okay!,joy
"And somewhere along the way, one of them is gonna realise what they’ve done and they’re call the whole thing off.",neutral
How are you feeling?,neutral
I’m telling you he’s dead. What we are about to have here is a dead fat guy on a stick.,anger
Hope! Hope!,joy
"Um, that's ok!  Ok. All right. Now we need the semen of a righteous man.",joy
"Oh, Nancy Thompson from Phoebe’s old massage place is getting fired.",neutral
Yeah. You okay?,neutral
"Oh, I-I, I think that's the first time I ever missed a meal!  Yeah, my pants are a little loose!",anger
Hey!,joy
What?,surprise
So go fix it!,neutral
"Hey, Pheebs.",neutral
"Y'know, we work in a museum of natural history, and yet there is something unnatural about the way we eat lunch.",neutral
I’m asking you to do me a favor.,neutral
What?,surprise
Okay.,neutral
"So you can either sulk here for a half hour and then go pick them up, or save us both time and sulk in the car.",anger
"Anyway, they want to take us out Saturday night! What do you say?",joy
I’m gonna go find that guy’s car and leave a note on the windshield.,neutral
And this is Rachel.,neutral
You mean they like you.,neutral
I just don’t know! It just doesn’t feel right.,sadness
"So, what are we gonna do today?",neutral
Yeah. I realized it about a half-hour ago but I didn't want to say anything 'cause I didn't want to jinx it.,neutral
"No. No, you're not a loser.",sadness
No.,neutral
Okay! Come on! Let's go! All right!,joy
"Okay, goodbye...",disgust
Hey! What's she doing back here?,surprise
Do you realize I have a classroom full of students?,anger
"Oh yeah, that sounds great.  Oh, and listen, it’s, it’s gonna be....",neutral
Okay!,joy
I found a dried up seashores.,neutral
Oh God!,joy
"No you’re not, you’re wondering which cushion it is.",neutral
"Yeah, I talked to you on the phone, I’m the lady that got stuck with the racecar bed.",neutral
"Ooh, very official.",neutral
"All right, you’re telling me you can eat an entire turkey in just one sitting?",neutral
I want to do it again.,anger
"Oh well, this was a really important experience for me, and    I wanted to share it with you.",joy
"But I stand by my review, I know food and that wasn’t it.",disgust
"Oh, that’s fine! Go with your instincts, go with your instincts.",joy
"I, I don’t know.",neutral
"Yeah, I wouldn’t know about that.",neutral
Just smile and don’t talk to,neutral
"Oh Joey, I’m hardly a",neutral
Monica!,sadness
"Okay. . Hello Drake, I'm surprised to see you    here.",surprise
"Oh you did, there are twenty in here.",neutral
Hey.,neutral
"I don't know, I kinda like Bob for a girl.",neutral
"Come on, no peeking!",joy
"Oh, no. But it’s just a two hour ferry ride to Nova Scotia.",neutral
"""We were on a break!""",anger
"Whoa, wait, Pheebs, wait a second! Don’t you wanna stay here and talk about it?",surprise
"Oh please, he didn’t hear it! He didn’t hear it!!",fear
"Hey, y’know what nickname never caught on? The Ross-A-Tron!",joy
I can’t say that I’m surprised.,neutral
"Ok, I'm sensing that this is some kind of word play, because you are pink with barely controlled glee.",neutral
"Oh, Hi, Ju——Hi, Jew!",neutral
It might be kinda cool.,joy
Yep! That's hilarious!,joy
Maybe two?,neutral
Would you stop that!,anger
"So uh, who’s your photographer?",neutral
Ross.,neutral
"Hey, buddy.",neutral
Are you serious?,surprise
Now you know how you really feel about it.,neutral
You do?,surprise
"That’s a good idea, ‘Dear Janice have a Hubba-Bubba birthday’. I would like to get her something serious.",disgust
What are you doing?,neutral
"Y’know what? He didn’t want to talk to us about being angry, well maybe we don’t talk to him",anger
"No,",neutral
You didn’t leave lipstick marks on the phone.,neutral
Weirdest thing. Did I hear——Mother of God it’s true!,surprise
"I'm right, right?",neutral
"And, Kristin, Kristin......does something that, funnily enough, wasn't even her major!",joy
"Yeah, the lovely Amanda gives me her number and I-I go and drop it.",anger
They’re wildly unpopular.,neutral
"No, no, I’m serious. Thank you.",joy
"No, don’t look directly at them!",fear
We’re not gonna do that.,disgust
How…How small are your feet?,neutral
"All right! But uh, listen, what do you say we crank it up a notch?",joy
Look! This is ridiculous. We should be packing you!!,anger
We could be like the Patch Sisters!,joy
Look he's a great guy and I love being with him but... you know.,joy
"Division, between people in white coats and people in blue blazers, and I ask myself, ""My God why?!""",fear
"Really? Okay, so why don’t you tell me what happened to Ross Junior year at",neutral
You cook naked?,surprise
"Just-just, you know, the-the lovely waterfalls, and the, the trickling fountains.",joy
"Ross, you gotta follow your heart.",neutral
Yes!!  Oh.,surprise
"Morning’s here! Sunshine is here! The sky is clear, the morning’s here! The morning’s here!",joy
I mean not that sitting at home worrying about giving birth to a sixteen pound baby is not fun.,neutral
What?!,surprise
I must say it's nice to see you back on your feet.,joy
"All right, this has got to stop!",anger
You gotta go!,neutral
"Great soap opera acting tonight everybody, class dismissed.",joy
For fun?,neutral
"Well, Chandler and I are in a bar",neutral
"Oh, uh, I... don't... care.",neutral
There was no kangaroo!,anger
"No, Chandler.",neutral
"I am telling you, years from now, schoolchildren will study it as one of the greatest first dates of all time.",neutral
I don’t think the contestants are supposed to speak to each other.,neutral
"Aw, don't do that",sadness
"Hey Rach, have you seen Charlie anywhere?",neutral
"He- he- he got in, he- he got in to San Diego.",joy
You freak.,disgust
"Definitely! Phoebe, you will not find a single game show host, who’s ass I cannot kick.",joy
"Oh, uh, listen, about tonight...",sadness
Oh! Ohh! Oh!!,surprise
"Okay look, look, let me ask you a question, when they were doing it on stage, was it like really hot?",neutral
Exactly!,joy
It looks like your uterus is ready for implantation.,neutral
"Yeah, I’ve always hated that Howie.",disgust
"I’m sorry, would you move your thumb? I can’t see the seat number.",neutral
"But I'll still always come back, like this.",neutral
"No you do—y'know what, you’re not gonna suck me into this.",anger
"Y’know, I’m beginning to see what Jake was talking about.",neutral
"I-I-I of course, I have more responsibilities than that.",neutral
"No-no-no-no, he’s not! No! Why are you trying to ruin the game? Come on!",anger
"Maybe they can take the needle and thquirt it into my mouth, you know, like a thquirt gun.",fear
What do you like better action or comedy?,neutral
Whoa!,surprise
Good.,neutral
Y’know what?,neutral
"OK, now I'm gonna kick some ass.",anger
"I can get out, ""Joey, I have too…"" but then I lose my nerve and I always finish with, ""…go to the bathroom.""",sadness
We're sorry.,sadness
Steady.,neutral
"Joey, that paper’s like a year old!",neutral
"Yeah, I gotta go.",fear
Yuh-huh!,anger
Hey! Great advice on that Joey thing!,joy
Oh that.,neutral
"Yeah! In fact, to prove how much you mean to me,  here.",neutral
Her name's Ronni. She's a pet mortician.,neutral
"Okay, I uh, I can't see you anymore.",sadness
So like which of these two guys do you want to be?,sadness
"Ok, That's it, Ben.",neutral
I was scared of telling you.,fear
"Uh, the sex.",neutral
Do you love her?,neutral
"It's your moral obligation, as a friend, as a woman, I think it's a feminist issue!",anger
Do it!,joy
Let’s.,neutral
"Um, could you please tell Sergei that um, I was fascinated by what Boutros Boutros Gali said in the New York Times.",neutral
"Aw, dammit!",surprise
Hey Bob.,neutral
"Well, I'll tell ya I do enjoy guilt, but, ah, it wasn't me.",anger
We- we had our first fight this morning.,neutral
"No-no, they're not very nice people.",neutral
"So do you think that these pictures—Are, are they trying to tell a story?",neutral
"Okay.  You uh, you wanna hear something weird?",joy
You like it?,joy
Ok.  Ok. Having a phone has finally paid off.,joy
"Umm Pheebs, remember when we were in the coffee house we decided that I was going to keep the uh, the cute guy’s cell phone?",neutral
"Come on, Ross? Remember back in college, when he fell in love with Carol and bought her that ridiculously expensive crystal duck?",neutral
"Y'know what Rach, maybe you should just, y'know stay here at the coffee house.",neutral
"Wait, now, what am I doing again?",surprise
You just saved me!,joy
Phoebe and Rachel!,anger
"And us, we'll be like, 'Wh-whoa, dude.'",joy
"Y'know, we work in a museum of natural history, and yet there is something unnatural about the way we eat lunch.",neutral
"I don’t wanna make any mistakes, alright?",anger
"All right, that's it. I want both of you out.",anger
You,neutral
"Ok, so now we need, um sage branches and the sacramental wine.",neutral
It’s very not good leaving candles unattended.,neutral
Tickets please!  That’s courtside baby!,joy
So I really never get to win anymore?,sadness
It was a project for one of the Home Ec classes.,neutral
Ow!,surprise
"No,",neutral
"I mean, was it Gina?",neutral
"You know, ever since I had that dream about him, and can't    get it out of my head!",joy
"Well actually, Ross doesn't.",neutral
"Yeah, he-he-he calls me up and asks me if he can edit my new movie.",anger
So let’s talk a little bit about your duties.,neutral
The end.,neutral
That-that he’s a-a complex fellow who’s unlikely to take a wife!,anger
Fantastic! I have one question: How is that possible?,surprise
"Now, maybe I would have a problem with this if it wasn’t for me and Joshua.",neutral
"I didn't even think about that!  Aaargh,",anger
Ok.,neutral
"Um-mm, yeah right!",joy
"Um,  Barry.",neutral
Who names their boat Coast Guard anyway?,disgust
What disposable cameras?,sadness
Oh-hey-hey-hey! There you are!,joy
Hey!,neutral
Pathetic mess?,neutral
"No look, I-I’m sure that people know you exist!",sadness
Oh. Maybe they're- napping.,neutral
What?!,surprise
"Good, and hey! My treat.  But that's only because you're not eating anything, right?",joy
Hey!,joy
"Yeah, I know. He can get really competitive.",neutral
Wow!,surprise
No problem.,neutral
Yep.,neutral
"I-I am so sorry, I’ll go.",sadness
"And Monica, with that snort when she laughs?",anger
"Hey, how do you guys get anything done?",joy
The first good thing she gets me in weeks.,neutral
You are not supposed to give people advice!,anger
"Ok, now, remember, no trading.",neutral
"What? Wait a minute, I didn’t pay, I thought you paid!",neutral
Yes I do!,joy
Yeah me too.,neutral
"Oh yeah, it must be tough to keep your hands of him, huh?",neutral
"More coffee over here, please!",joy
Bijan for men?,neutral
"Okay, sorry. Yeah.",neutral
Okay.,neutral
"Joey,  where did you learn that word?",surprise
"Oh my God, look-look he’s taking off her clothes!",sadness
"Yes, thank you so much. And again, we’re so sorry. We could not feel worse about it.",joy
Are you're hands still wet?,neutral
Hey! Where ‘ya headin’ in those pants? 1982?,joy
"I don’t know, something girlie.",joy
I know!,surprise
Hold it!  N.Y.P.D! Freeze punk!,anger
"Now, after you receive the doubling bonus, you get uh, one card.",neutral
Oh! And don’t let me leave without getting the name of that carpet guy.,neutral
"We were walking by this antique store, and I saw this pin in the window, and I told him that it was just like one my grandmother had when I was a little girl.",sadness
"We can’t tell him, you can’t go up to a guy you barely know and talk about his.... stuff.",anger
"You do this, you give me the great advice, and hey listen, I was thinking about what you said yesterday about focusing on one woman, I’m gonna do that.",joy
"Chandler, I gotta tell you, I love your mom's books!",joy
"Oh, the duck seems to think that Monica got me garbage! Hmm, I wonder what I could get Monica that’s as good as garbage?",anger
"Okay, I guess we can lose to junior high girls some other time.",neutral
I am strong! I’ll show you!,anger
Y'know that whole swimming thing is a myth.,neutral
"Well, if that were true, I’d dating my Aunt Ruth.",joy
"Oh, just hanging out, talkin’ about uh, websites.",neutral
Nope. Going to the,neutral
"Noo!! I don’t care! I’m not, I’m not gonna playing one-on-one strip poker with you for practice!",anger
What?!,surprise
"It’s called the Bapstein-King comet, okay?  Hey! Hey! Bapstein was a very well respected astronomer!",anger
"Honey, really, don't squeeze it so hard!",anger
"Sure, I can hang out ‘til I have to meet ya.  What uh—How come you’re not going?",neutral
"Well no, wait a minute, that’s not true!",sadness
"No Phoebe, don’t look! You don’t want to see what’s under there!!",fear
"I will be! Listen, I don’t want you teaching my son that stuff anymore. Okay?",anger
"Let me get this straight man, you attacked your ex-wife?!",anger
Here it is! Here it is!,joy
What!?,surprise
"Yeah, you want some?",neutral
Oh hey you guys!,joy
"Y’know, we don’t have to imagine.",neutral
"Hey, that’s never gonna make it all the way over here, buddy!",anger
What?! You kissed!,surprise
"Well, I didn’t realize until I got home.",neutral
Okay.,neutral
Oh.,neutral
"Sorry I ah, I scared you in there.",sadness
Nngghhh!!!!!!!,anger
"Whoa-whoops, I almost lost this baby!",joy
And Bobby’s gonna be here the whole time.,neutral
We’re not throwing it away! I built that canoe!,anger
He is so amazing.,joy
I wasn’t gonna walk all the way back down here with one shoe!,neutral
You can spill. In the sink.,neutral
"And sometimes I may be away longer, like this.",neutral
Of course I do! And I’m gonna give it back to you as soon as they’re done with it at the key shining place.,neutral
"Um, y'know, before we go ah, there’s something I need to say.",fear
"Y'know what, actually…  Okay, okay, okay, what's so funny over here?",neutral
What?!,surprise
Wow! We are pretty good at this! Hey! We totally forgot about lunch!,surprise
"Allright, fine, I only have one thought! It's about the hot nanny,    I gotta see her!",joy
"Wait a minute, open up your hand; let me take a look.",neutral
Phoebe!,surprise
What?!,surprise
"Oh, this is so good  you have got to try it.",joy
"Now, I know what you’re thinking, Chandler’s not the type of guy who just goes to bars and makes out with girls, and you’re right, Chandler’s not the type of guy who just goes to bars and makes out with…girls.",joy
What for?,neutral
Okay.,neutral
Sorry.,neutral
"Ben, I want you to know that there may be some times when I may not be around, like this.",sadness
Shut the book!,joy
What's going on with you?,surprise
It’s not something you are! It’s something you have!,anger
"Um, now. Phoebs.",neutral
"All right, how about the ladybugs?",neutral
My agent would like to know why I didn't show up at the audition I didn't know I had today.,anger
Fun’s over,joy
"I'm just sayin' if dogs do experience jet lag, then, because of the whole um, seven dog years to one human year thing, then, when a dog flies from New York to Los Angeles, he doesn't just lose three hours, he loses like a week and a half.",neutral
"Yeah, but I didn’t get to see it.",sadness
No.,neutral
Is he crazy?! You just had Ross’s baby!,surprise
You mean those-those little colored labels you put on all the folders?,neutral
"You know what honey, you go ahead, we’ll call her an alternate.",neutral
Instead of...?,surprise
"Hey! I'm in, they're gonna let me audition!",joy
